19:09:29.962396 IP localhost.64131 > localhost.amqp: Flags [S], seq 854100395, win 65535, options [mss 16344,nop,wscale 6,nop,nop,TS val 418460508 ecr 0,sackOK,eol], length 0
19:09:29.962480 IP localhost.amqp > localhost.64131: Flags [S.], seq 3629513539, ack 854100396, win 65535, options [mss 16344,nop,wscale 6,nop,nop,TS val 2781949231 ecr 418460508,sackOK,eol], length 0
19:09:29.962494 IP localhost.64131 > localhost.amqp: Flags [.], ack 1, win 6379, options [nop,nop,TS val 418460508 ecr 2781949231], length 0
19:09:29.962502 IP localhost.amqp > localhost.64131: Flags [.], ack 1, win 6379, options [nop,nop,TS val 2781949231 ecr 418460508], length 0
19:09:29.962530 IP localhost.64131 > localhost.amqp: Flags [P.], seq 1:9, ack 1, win 6379, options [nop,nop,TS val 418460508 ecr 2781949231], length 8
19:09:29.962548 IP localhost.amqp > localhost.64131: Flags [.], ack 9, win 6379, options [nop,nop,TS val 2781949231 ecr 418460508], length 0
19:09:29.962564 IP localhost.amqp > localhost.64131: Flags [P.], seq 1:514, ack 9, win 6379, options [nop,nop,TS val 2781949231 ecr 418460508], length 513
19:09:29.962578 IP localhost.64131 > localhost.amqp: Flags [.], ack 514, win 6371, options [nop,nop,TS val 418460508 ecr 2781949231], length 0
19:09:29.962615 IP localhost.64131 > localhost.amqp: Flags [P.], seq 9:338, ack 514, win 6371, options [nop,nop,TS val 418460508 ecr 2781949231], length 329
19:09:29.962630 IP localhost.amqp > localhost.64131: Flags [.], ack 338, win 6374, options [nop,nop,TS val 2781949231 ecr 418460508], length 0
19:09:29.962667 IP localhost.amqp > localhost.64131: Flags [P.], seq 514:534, ack 338, win 6374, options [nop,nop,TS val 2781949231 ecr 418460508], length 20
19:09:29.962681 IP localhost.64131 > localhost.amqp: Flags [.], ack 534, win 6371, options [nop,nop,TS val 418460508 ecr 2781949231], length 0
19:09:29.962733 IP localhost.64131 > localhost.amqp: Flags [P.], seq 338:358, ack 534, win 6371, options [nop,nop,TS val 418460508 ecr 2781949231], length 20
19:09:29.962736 IP localhost.64131 > localhost.amqp: Flags [P.], seq 358:374, ack 534, win 6371, options [nop,nop,TS val 418460508 ecr 2781949231], length 16
19:09:29.962751 IP localhost.amqp > localhost.64131: Flags [.], ack 358, win 6374, options [nop,nop,TS val 2781949231 ecr 418460508], length 0
19:09:29.962756 IP localhost.amqp > localhost.64131: Flags [.], ack 374, win 6373, options [nop,nop,TS val 2781949231 ecr 418460508], length 0
19:09:29.962772 IP localhost.amqp > localhost.64131: Flags [P.], seq 534:547, ack 374, win 6373, options [nop,nop,TS val 2781949231 ecr 418460508], length 13
19:09:29.962787 IP localhost.64131 > localhost.amqp: Flags [.], ack 547, win 6371, options [nop,nop,TS val 418460508 ecr 2781949231], length 0
19:09:29.962809 IP localhost.64131 > localhost.amqp: Flags [P.], seq 374:387, ack 547, win 6371, options [nop,nop,TS val 418460508 ecr 2781949231], length 13
19:09:29.962823 IP localhost.amqp > localhost.64131: Flags [.], ack 387, win 6373, options [nop,nop,TS val 2781949231 ecr 418460508], length 0
19:09:29.962843 IP localhost.amqp > localhost.64131: Flags [P.], seq 547:563, ack 387, win 6373, options [nop,nop,TS val 2781949231 ecr 418460508], length 16
19:09:29.962857 IP localhost.64131 > localhost.amqp: Flags [.], ack 563, win 6370, options [nop,nop,TS val 418460508 ecr 2781949231], length 0
19:09:29.962893 IP localhost.64131 > localhost.amqp: Flags [P.], seq 387:413, ack 563, win 6370, options [nop,nop,TS val 418460508 ecr 2781949231], length 26
19:09:29.962909 IP localhost.amqp > localhost.64131: Flags [.], ack 413, win 6373, options [nop,nop,TS val 2781949231 ecr 418460508], length 0
19:09:29.962931 IP localhost.amqp > localhost.64131: Flags [P.], seq 563:590, ack 413, win 6373, options [nop,nop,TS val 2781949231 ecr 418460508], length 27
19:09:29.962953 IP localhost.64131 > localhost.amqp: Flags [.], ack 590, win 6370, options [nop,nop,TS val 418460508 ecr 2781949231], length 0
19:09:29.962982 IP localhost.64131 > localhost.amqp: Flags [P.], seq 413:435, ack 590, win 6370, options [nop,nop,TS val 418460508 ecr 2781949231], length 22
19:09:29.962998 IP localhost.amqp > localhost.64131: Flags [.], ack 435, win 6372, options [nop,nop,TS val 2781949231 ecr 418460508], length 0
19:09:29.963018 IP localhost.amqp > localhost.64131: Flags [P.], seq 590:602, ack 435, win 6372, options [nop,nop,TS val 2781949231 ecr 418460508], length 12
19:09:29.963031 IP localhost.64131 > localhost.amqp: Flags [.], ack 602, win 6370, options [nop,nop,TS val 418460508 ecr 2781949231], length 0
19:09:29.963053 IP localhost.64131 > localhost.amqp: Flags [P.], seq 435:457, ack 602, win 6370, options [nop,nop,TS val 418460508 ecr 2781949231], length 22
19:09:29.963067 IP localhost.amqp > localhost.64131: Flags [.], ack 457, win 6372, options [nop,nop,TS val 2781949231 ecr 418460508], length 0
19:09:29.963087 IP localhost.amqp > localhost.64131: Flags [P.], seq 602:614, ack 457, win 6372, options [nop,nop,TS val 2781949231 ecr 418460508], length 12
19:09:29.963102 IP localhost.64131 > localhost.amqp: Flags [.], ack 614, win 6370, options [nop,nop,TS val 418460508 ecr 2781949231], length 0
19:09:29.963125 IP localhost.64131 > localhost.amqp: Flags [F.], seq 457, ack 614, win 6370, options [nop,nop,TS val 418460508 ecr 2781949231], length 0
19:09:29.963140 IP localhost.amqp > localhost.64131: Flags [.], ack 458, win 6372, options [nop,nop,TS val 2781949231 ecr 418460508], length 0
19:09:29.974652 IP localhost.64132 > localhost.amqp: Flags [S], seq 3865326108, win 65535, options [mss 16344,nop,wscale 6,nop,nop,TS val 509311120 ecr 0,sackOK,eol], length 0
19:09:29.974757 IP localhost.amqp > localhost.64132: Flags [S.], seq 1866968068, ack 3865326109, win 65535, options [mss 16344,nop,wscale 6,nop,nop,TS val 1921374346 ecr 509311120,sackOK,eol], length 0
19:09:29.974775 IP localhost.64132 > localhost.amqp: Flags [.], ack 1, win 6379, options [nop,nop,TS val 509311120 ecr 1921374346], length 0
19:09:29.974786 IP localhost.amqp > localhost.64132: Flags [.], ack 1, win 6379, options [nop,nop,TS val 1921374346 ecr 509311120], length 0
19:09:29.974811 IP localhost.64132 > localhost.amqp: Flags [P.], seq 1:9, ack 1, win 6379, options [nop,nop,TS val 509311120 ecr 1921374346], length 8
19:09:29.974838 IP localhost.amqp > localhost.64132: Flags [.], ack 9, win 6379, options [nop,nop,TS val 1921374346 ecr 509311120], length 0
19:09:29.974847 IP localhost.amqp > localhost.64132: Flags [P.], seq 1:514, ack 9, win 6379, options [nop,nop,TS val 1921374346 ecr 509311120], length 513
19:09:29.974855 IP localhost.64132 > localhost.amqp: Flags [.], ack 514, win 6371, options [nop,nop,TS val 509311120 ecr 1921374346], length 0
19:09:29.974907 IP localhost.64132 > localhost.amqp: Flags [P.], seq 9:338, ack 514, win 6371, options [nop,nop,TS val 509311120 ecr 1921374346], length 329
19:09:29.974928 IP localhost.amqp > localhost.64132: Flags [.], ack 338, win 6374, options [nop,nop,TS val 1921374346 ecr 509311120], length 0
19:09:29.974968 IP localhost.amqp > localhost.64132: Flags [P.], seq 514:534, ack 338, win 6374, options [nop,nop,TS val 1921374346 ecr 509311120], length 20
19:09:29.974987 IP localhost.64132 > localhost.amqp: Flags [.], ack 534, win 6371, options [nop,nop,TS val 509311120 ecr 1921374346], length 0
19:09:29.975033 IP localhost.64132 > localhost.amqp: Flags [P.], seq 338:358, ack 534, win 6371, options [nop,nop,TS val 509311120 ecr 1921374346], length 20
19:09:29.975036 IP localhost.64132 > localhost.amqp: Flags [P.], seq 358:374, ack 534, win 6371, options [nop,nop,TS val 509311120 ecr 1921374346], length 16
19:09:29.975053 IP localhost.amqp > localhost.64132: Flags [.], ack 358, win 6374, options [nop,nop,TS val 1921374346 ecr 509311120], length 0
19:09:29.975061 IP localhost.amqp > localhost.64132: Flags [.], ack 374, win 6373, options [nop,nop,TS val 1921374346 ecr 509311120], length 0
19:09:29.975089 IP localhost.amqp > localhost.64132: Flags [P.], seq 534:547, ack 374, win 6373, options [nop,nop,TS val 1921374346 ecr 509311120], length 13
19:09:29.975107 IP localhost.64132 > localhost.amqp: Flags [.], ack 547, win 6371, options [nop,nop,TS val 509311120 ecr 1921374346], length 0
19:09:29.975143 IP localhost.64132 > localhost.amqp: Flags [P.], seq 374:387, ack 547, win 6371, options [nop,nop,TS val 509311120 ecr 1921374346], length 13
19:09:29.975161 IP localhost.amqp > localhost.64132: Flags [.], ack 387, win 6373, options [nop,nop,TS val 1921374346 ecr 509311120], length 0
19:09:29.975195 IP localhost.amqp > localhost.64132: Flags [P.], seq 547:563, ack 387, win 6373, options [nop,nop,TS val 1921374346 ecr 509311120], length 16
19:09:29.975213 IP localhost.64132 > localhost.amqp: Flags [.], ack 563, win 6370, options [nop,nop,TS val 509311120 ecr 1921374346], length 0
19:09:29.975259 IP localhost.64132 > localhost.amqp: Flags [P.], seq 387:413, ack 563, win 6370, options [nop,nop,TS val 509311120 ecr 1921374346], length 26
19:09:29.975277 IP localhost.amqp > localhost.64132: Flags [.], ack 413, win 6373, options [nop,nop,TS val 1921374346 ecr 509311120], length 0
19:09:29.975312 IP localhost.amqp > localhost.64132: Flags [P.], seq 563:590, ack 413, win 6373, options [nop,nop,TS val 1921374346 ecr 509311120], length 27
19:09:29.975330 IP localhost.64132 > localhost.amqp: Flags [.], ack 590, win 6370, options [nop,nop,TS val 509311120 ecr 1921374346], length 0
19:09:29.975372 IP localhost.64132 > localhost.amqp: Flags [P.], seq 413:435, ack 590, win 6370, options [nop,nop,TS val 509311120 ecr 1921374346], length 22
19:09:29.975390 IP localhost.amqp > localhost.64132: Flags [.], ack 435, win 6372, options [nop,nop,TS val 1921374346 ecr 509311120], length 0
19:09:29.975424 IP localhost.amqp > localhost.64132: Flags [P.], seq 590:602, ack 435, win 6372, options [nop,nop,TS val 1921374346 ecr 509311120], length 12
19:09:29.975442 IP localhost.64132 > localhost.amqp: Flags [.], ack 602, win 6370, options [nop,nop,TS val 509311120 ecr 1921374346], length 0
19:09:29.975478 IP localhost.64132 > localhost.amqp: Flags [P.], seq 435:457, ack 602, win 6370, options [nop,nop,TS val 509311120 ecr 1921374346], length 22
19:09:29.975495 IP localhost.amqp > localhost.64132: Flags [.], ack 457, win 6372, options [nop,nop,TS val 1921374346 ecr 509311120], length 0
19:09:29.975531 IP localhost.amqp > localhost.64132: Flags [P.], seq 602:614, ack 457, win 6372, options [nop,nop,TS val 1921374346 ecr 509311120], length 12
19:09:29.975549 IP localhost.64132 > localhost.amqp: Flags [.], ack 614, win 6370, options [nop,nop,TS val 509311120 ecr 1921374346], length 0
19:09:29.975591 IP localhost.64132 > localhost.amqp: Flags [F.], seq 457, ack 614, win 6370, options [nop,nop,TS val 509311120 ecr 1921374346], length 0
19:09:29.975610 IP localhost.amqp > localhost.64132: Flags [.], ack 458, win 6372, options [nop,nop,TS val 1921374346 ecr 509311120], length 0
19:09:29.987258 IP localhost.64133 > localhost.amqp: Flags [S], seq 837907111, win 65535, options [mss 16344,nop,wscale 6,nop,nop,TS val 3093146492 ecr 0,sackOK,eol], length 0
19:09:29.987349 IP localhost.amqp > localhost.64133: Flags [S.], seq 3411217380, ack 837907112, win 65535, options [mss 16344,nop,wscale 6,nop,nop,TS val 2596906203 ecr 3093146492,sackOK,eol], length 0
19:09:29.987365 IP localhost.64133 > localhost.amqp: Flags [.], ack 1, win 6379, options [nop,nop,TS val 3093146492 ecr 2596906203], length 0
19:09:29.987373 IP localhost.amqp > localhost.64133: Flags [.], ack 1, win 6379, options [nop,nop,TS val 2596906203 ecr 3093146492], length 0
19:09:29.987405 IP localhost.64133 > localhost.amqp: Flags [P.], seq 1:9, ack 1, win 6379, options [nop,nop,TS val 3093146492 ecr 2596906203], length 8
19:09:29.987420 IP localhost.amqp > localhost.64133: Flags [.], ack 9, win 6379, options [nop,nop,TS val 2596906203 ecr 3093146492], length 0
19:09:29.987440 IP localhost.amqp > localhost.64133: Flags [P.], seq 1:514, ack 9, win 6379, options [nop,nop,TS val 2596906203 ecr 3093146492], length 513
19:09:29.987456 IP localhost.64133 > localhost.amqp: Flags [.], ack 514, win 6371, options [nop,nop,TS val 3093146492 ecr 2596906203], length 0
19:09:29.987491 IP localhost.64133 > localhost.amqp: Flags [P.], seq 9:338, ack 514, win 6371, options [nop,nop,TS val 3093146492 ecr 2596906203], length 329
19:09:29.987507 IP localhost.amqp > localhost.64133: Flags [.], ack 338, win 6374, options [nop,nop,TS val 2596906203 ecr 3093146492], length 0
19:09:29.987547 IP localhost.amqp > localhost.64133: Flags [P.], seq 514:534, ack 338, win 6374, options [nop,nop,TS val 2596906203 ecr 3093146492], length 20
19:09:29.987562 IP localhost.64133 > localhost.amqp: Flags [.], ack 534, win 6371, options [nop,nop,TS val 3093146492 ecr 2596906203], length 0
19:09:29.987613 IP localhost.64133 > localhost.amqp: Flags [P.], seq 338:358, ack 534, win 6371, options [nop,nop,TS val 3093146492 ecr 2596906203], length 20
19:09:29.987616 IP localhost.64133 > localhost.amqp: Flags [P.], seq 358:374, ack 534, win 6371, options [nop,nop,TS val 3093146492 ecr 2596906203], length 16
19:09:29.987631 IP localhost.amqp > localhost.64133: Flags [.], ack 358, win 6374, options [nop,nop,TS val 2596906203 ecr 3093146492], length 0
19:09:29.987637 IP localhost.amqp > localhost.64133: Flags [.], ack 374, win 6373, options [nop,nop,TS val 2596906203 ecr 3093146492], length 0
19:09:29.987667 IP localhost.amqp > localhost.64133: Flags [P.], seq 534:547, ack 374, win 6373, options [nop,nop,TS val 2596906203 ecr 3093146492], length 13
19:09:29.987683 IP localhost.64133 > localhost.amqp: Flags [.], ack 547, win 6371, options [nop,nop,TS val 3093146492 ecr 2596906203], length 0
19:09:29.987722 IP localhost.64133 > localhost.amqp: Flags [P.], seq 374:387, ack 547, win 6371, options [nop,nop,TS val 3093146492 ecr 2596906203], length 13
19:09:29.987737 IP localhost.amqp > localhost.64133: Flags [.], ack 387, win 6373, options [nop,nop,TS val 2596906203 ecr 3093146492], length 0
19:09:29.987775 IP localhost.amqp > localhost.64133: Flags [P.], seq 547:563, ack 387, win 6373, options [nop,nop,TS val 2596906203 ecr 3093146492], length 16
19:09:29.987790 IP localhost.64133 > localhost.amqp: Flags [.], ack 563, win 6370, options [nop,nop,TS val 3093146492 ecr 2596906203], length 0
19:09:29.987841 IP localhost.64133 > localhost.amqp: Flags [P.], seq 387:413, ack 563, win 6370, options [nop,nop,TS val 3093146492 ecr 2596906203], length 26
19:09:29.987857 IP localhost.amqp > localhost.64133: Flags [.], ack 413, win 6373, options [nop,nop,TS val 2596906203 ecr 3093146492], length 0
19:09:29.987895 IP localhost.amqp > localhost.64133: Flags [P.], seq 563:590, ack 413, win 6373, options [nop,nop,TS val 2596906203 ecr 3093146492], length 27
19:09:29.987911 IP localhost.64133 > localhost.amqp: Flags [.], ack 590, win 6370, options [nop,nop,TS val 3093146492 ecr 2596906203], length 0
19:09:29.987950 IP localhost.64133 > localhost.amqp: Flags [P.], seq 413:435, ack 590, win 6370, options [nop,nop,TS val 3093146492 ecr 2596906203], length 22
19:09:29.987966 IP localhost.amqp > localhost.64133: Flags [.], ack 435, win 6372, options [nop,nop,TS val 2596906203 ecr 3093146492], length 0
19:09:29.988006 IP localhost.amqp > localhost.64133: Flags [P.], seq 590:602, ack 435, win 6372, options [nop,nop,TS val 2596906203 ecr 3093146492], length 12
19:09:29.988022 IP localhost.64133 > localhost.amqp: Flags [.], ack 602, win 6370, options [nop,nop,TS val 3093146492 ecr 2596906203], length 0
19:09:29.988060 IP localhost.64133 > localhost.amqp: Flags [P.], seq 435:457, ack 602, win 6370, options [nop,nop,TS val 3093146492 ecr 2596906203], length 22
19:09:29.988076 IP localhost.amqp > localhost.64133: Flags [.], ack 457, win 6372, options [nop,nop,TS val 2596906203 ecr 3093146492], length 0
19:09:29.988114 IP localhost.amqp > localhost.64133: Flags [P.], seq 602:614, ack 457, win 6372, options [nop,nop,TS val 2596906203 ecr 3093146492], length 12
19:09:29.988130 IP localhost.64133 > localhost.amqp: Flags [.], ack 614, win 6370, options [nop,nop,TS val 3093146492 ecr 2596906203], length 0
19:09:29.988177 IP localhost.64133 > localhost.amqp: Flags [F.], seq 457, ack 614, win 6370, options [nop,nop,TS val 3093146492 ecr 2596906203], length 0
19:09:29.988195 IP localhost.amqp > localhost.64133: Flags [.], ack 458, win 6372, options [nop,nop,TS val 2596906203 ecr 3093146492], length 0
19:09:29.999329 IP localhost.64134 > localhost.amqp: Flags [S], seq 3798038661, win 65535, options [mss 16344,nop,wscale 6,nop,nop,TS val 2933562973 ecr 0,sackOK,eol], length 0
19:09:29.999420 IP localhost.amqp > localhost.64134: Flags [S.], seq 159474510, ack 3798038662, win 65535, options [mss 16344,nop,wscale 6,nop,nop,TS val 2392005486 ecr 2933562973,sackOK,eol], length 0
19:09:29.999436 IP localhost.64134 > localhost.amqp: Flags [.], ack 1, win 6379, options [nop,nop,TS val 2933562973 ecr 2392005486], length 0
19:09:29.999444 IP localhost.amqp > localhost.64134: Flags [.], ack 1, win 6379, options [nop,nop,TS val 2392005486 ecr 2933562973], length 0
19:09:29.999470 IP localhost.64134 > localhost.amqp: Flags [P.], seq 1:9, ack 1, win 6379, options [nop,nop,TS val 2933562973 ecr 2392005486], length 8
19:09:29.999487 IP localhost.amqp > localhost.64134: Flags [.], ack 9, win 6379, options [nop,nop,TS val 2392005486 ecr 2933562973], length 0
19:09:29.999501 IP localhost.amqp > localhost.64134: Flags [P.], seq 1:514, ack 9, win 6379, options [nop,nop,TS val 2392005486 ecr 2933562973], length 513
19:09:29.999516 IP localhost.64134 > localhost.amqp: Flags [.], ack 514, win 6371, options [nop,nop,TS val 2933562973 ecr 2392005486], length 0
19:09:29.999551 IP localhost.64134 > localhost.amqp: Flags [P.], seq 9:338, ack 514, win 6371, options [nop,nop,TS val 2933562973 ecr 2392005486], length 329
19:09:29.999566 IP localhost.amqp > localhost.64134: Flags [.], ack 338, win 6374, options [nop,nop,TS val 2392005486 ecr 2933562973], length 0
19:09:29.999604 IP localhost.amqp > localhost.64134: Flags [P.], seq 514:534, ack 338, win 6374, options [nop,nop,TS val 2392005486 ecr 2933562973], length 20
19:09:29.999619 IP localhost.64134 > localhost.amqp: Flags [.], ack 534, win 6371, options [nop,nop,TS val 2933562973 ecr 2392005486], length 0
19:09:29.999667 IP localhost.64134 > localhost.amqp: Flags [P.], seq 338:358, ack 534, win 6371, options [nop,nop,TS val 2933562973 ecr 2392005486], length 20
19:09:29.999670 IP localhost.64134 > localhost.amqp: Flags [P.], seq 358:374, ack 534, win 6371, options [nop,nop,TS val 2933562973 ecr 2392005486], length 16
19:09:29.999683 IP localhost.amqp > localhost.64134: Flags [.], ack 358, win 6374, options [nop,nop,TS val 2392005486 ecr 2933562973], length 0
19:09:29.999689 IP localhost.amqp > localhost.64134: Flags [.], ack 374, win 6373, options [nop,nop,TS val 2392005486 ecr 2933562973], length 0
19:09:29.999723 IP localhost.amqp > localhost.64134: Flags [P.], seq 534:547, ack 374, win 6373, options [nop,nop,TS val 2392005486 ecr 2933562973], length 13
19:09:29.999738 IP localhost.64134 > localhost.amqp: Flags [.], ack 547, win 6371, options [nop,nop,TS val 2933562973 ecr 2392005486], length 0
19:09:29.999776 IP localhost.64134 > localhost.amqp: Flags [P.], seq 374:387, ack 547, win 6371, options [nop,nop,TS val 2933562973 ecr 2392005486], length 13
19:09:29.999790 IP localhost.amqp > localhost.64134: Flags [.], ack 387, win 6373, options [nop,nop,TS val 2392005486 ecr 2933562973], length 0
19:09:29.999827 IP localhost.amqp > localhost.64134: Flags [P.], seq 547:563, ack 387, win 6373, options [nop,nop,TS val 2392005486 ecr 2933562973], length 16
19:09:29.999842 IP localhost.64134 > localhost.amqp: Flags [.], ack 563, win 6370, options [nop,nop,TS val 2933562973 ecr 2392005486], length 0
19:09:29.999887 IP localhost.64134 > localhost.amqp: Flags [P.], seq 387:413, ack 563, win 6370, options [nop,nop,TS val 2933562973 ecr 2392005486], length 26
19:09:29.999902 IP localhost.amqp > localhost.64134: Flags [.], ack 413, win 6373, options [nop,nop,TS val 2392005486 ecr 2933562973], length 0
19:09:29.999942 IP localhost.amqp > localhost.64134: Flags [P.], seq 563:590, ack 413, win 6373, options [nop,nop,TS val 2392005486 ecr 2933562973], length 27
19:09:29.999957 IP localhost.64134 > localhost.amqp: Flags [.], ack 590, win 6370, options [nop,nop,TS val 2933562973 ecr 2392005486], length 0
19:09:29.999997 IP localhost.64134 > localhost.amqp: Flags [P.], seq 413:435, ack 590, win 6370, options [nop,nop,TS val 2933562973 ecr 2392005486], length 22
19:09:30.000012 IP localhost.amqp > localhost.64134: Flags [.], ack 435, win 6372, options [nop,nop,TS val 2392005486 ecr 2933562973], length 0
19:09:30.000047 IP localhost.amqp > localhost.64134: Flags [P.], seq 590:602, ack 435, win 6372, options [nop,nop,TS val 2392005486 ecr 2933562973], length 12
19:09:30.000062 IP localhost.64134 > localhost.amqp: Flags [.], ack 602, win 6370, options [nop,nop,TS val 2933562973 ecr 2392005486], length 0
19:09:30.000097 IP localhost.64134 > localhost.amqp: Flags [P.], seq 435:457, ack 602, win 6370, options [nop,nop,TS val 2933562973 ecr 2392005486], length 22
19:09:30.000112 IP localhost.amqp > localhost.64134: Flags [.], ack 457, win 6372, options [nop,nop,TS val 2392005486 ecr 2933562973], length 0
19:09:30.000147 IP localhost.amqp > localhost.64134: Flags [P.], seq 602:614, ack 457, win 6372, options [nop,nop,TS val 2392005486 ecr 2933562973], length 12
19:09:30.000162 IP localhost.64134 > localhost.amqp: Flags [.], ack 614, win 6370, options [nop,nop,TS val 2933562973 ecr 2392005486], length 0
19:09:30.000206 IP localhost.64134 > localhost.amqp: Flags [F.], seq 457, ack 614, win 6370, options [nop,nop,TS val 2933562973 ecr 2392005486], length 0
19:09:30.000223 IP localhost.amqp > localhost.64134: Flags [.], ack 458, win 6372, options [nop,nop,TS val 2392005486 ecr 2933562973], length 0
19:09:30.011410 IP localhost.64135 > localhost.amqp: Flags [S], seq 3441128419, win 65535, options [mss 16344,nop,wscale 6,nop,nop,TS val 1983773389 ecr 0,sackOK,eol], length 0
19:09:30.011499 IP localhost.amqp > localhost.64135: Flags [S.], seq 2549165153, ack 3441128420, win 65535, options [mss 16344,nop,wscale 6,nop,nop,TS val 3025045569 ecr 1983773389,sackOK,eol], length 0
19:09:30.011514 IP localhost.64135 > localhost.amqp: Flags [.], ack 1, win 6379, options [nop,nop,TS val 1983773389 ecr 3025045569], length 0
19:09:30.011523 IP localhost.amqp > localhost.64135: Flags [.], ack 1, win 6379, options [nop,nop,TS val 3025045569 ecr 1983773389], length 0
19:09:30.011548 IP localhost.64135 > localhost.amqp: Flags [P.], seq 1:9, ack 1, win 6379, options [nop,nop,TS val 1983773389 ecr 3025045569], length 8
19:09:30.011569 IP localhost.amqp > localhost.64135: Flags [.], ack 9, win 6379, options [nop,nop,TS val 3025045569 ecr 1983773389], length 0
19:09:30.011576 IP localhost.amqp > localhost.64135: Flags [P.], seq 1:514, ack 9, win 6379, options [nop,nop,TS val 3025045569 ecr 1983773389], length 513
19:09:30.011586 IP localhost.64135 > localhost.amqp: Flags [.], ack 514, win 6371, options [nop,nop,TS val 1983773389 ecr 3025045569], length 0
19:09:30.011614 IP localhost.64135 > localhost.amqp: Flags [P.], seq 9:338, ack 514, win 6371, options [nop,nop,TS val 1983773389 ecr 3025045569], length 329
19:09:30.011639 IP localhost.amqp > localhost.64135: Flags [.], ack 338, win 6374, options [nop,nop,TS val 3025045569 ecr 1983773389], length 0
19:09:30.011691 IP localhost.amqp > localhost.64135: Flags [P.], seq 514:534, ack 338, win 6374, options [nop,nop,TS val 3025045569 ecr 1983773389], length 20
19:09:30.011709 IP localhost.64135 > localhost.amqp: Flags [.], ack 534, win 6371, options [nop,nop,TS val 1983773389 ecr 3025045569], length 0
19:09:30.011763 IP localhost.64135 > localhost.amqp: Flags [P.], seq 338:358, ack 534, win 6371, options [nop,nop,TS val 1983773389 ecr 3025045569], length 20
19:09:30.011766 IP localhost.64135 > localhost.amqp: Flags [P.], seq 358:374, ack 534, win 6371, options [nop,nop,TS val 1983773389 ecr 3025045569], length 16
19:09:30.011784 IP localhost.amqp > localhost.64135: Flags [.], ack 358, win 6374, options [nop,nop,TS val 3025045569 ecr 1983773389], length 0
19:09:30.011790 IP localhost.amqp > localhost.64135: Flags [.], ack 374, win 6373, options [nop,nop,TS val 3025045569 ecr 1983773389], length 0
19:09:30.011822 IP localhost.amqp > localhost.64135: Flags [P.], seq 534:547, ack 374, win 6373, options [nop,nop,TS val 3025045569 ecr 1983773389], length 13
19:09:30.011841 IP localhost.64135 > localhost.amqp: Flags [.], ack 547, win 6371, options [nop,nop,TS val 1983773389 ecr 3025045569], length 0
19:09:30.011876 IP localhost.64135 > localhost.amqp: Flags [P.], seq 374:387, ack 547, win 6371, options [nop,nop,TS val 1983773389 ecr 3025045569], length 13
19:09:30.011894 IP localhost.amqp > localhost.64135: Flags [.], ack 387, win 6373, options [nop,nop,TS val 3025045569 ecr 1983773389], length 0
19:09:30.011933 IP localhost.amqp > localhost.64135: Flags [P.], seq 547:563, ack 387, win 6373, options [nop,nop,TS val 3025045569 ecr 1983773389], length 16
19:09:30.011951 IP localhost.64135 > localhost.amqp: Flags [.], ack 563, win 6370, options [nop,nop,TS val 1983773389 ecr 3025045569], length 0
19:09:30.012003 IP localhost.64135 > localhost.amqp: Flags [P.], seq 387:413, ack 563, win 6370, options [nop,nop,TS val 1983773389 ecr 3025045569], length 26
19:09:30.012022 IP localhost.amqp > localhost.64135: Flags [.], ack 413, win 6373, options [nop,nop,TS val 3025045569 ecr 1983773389], length 0
19:09:30.012060 IP localhost.amqp > localhost.64135: Flags [P.], seq 563:590, ack 413, win 6373, options [nop,nop,TS val 3025045569 ecr 1983773389], length 27
19:09:30.012078 IP localhost.64135 > localhost.amqp: Flags [.], ack 590, win 6370, options [nop,nop,TS val 1983773389 ecr 3025045569], length 0
19:09:30.012121 IP localhost.64135 > localhost.amqp: Flags [P.], seq 413:435, ack 590, win 6370, options [nop,nop,TS val 1983773389 ecr 3025045569], length 22
19:09:30.012141 IP localhost.amqp > localhost.64135: Flags [.], ack 435, win 6372, options [nop,nop,TS val 3025045569 ecr 1983773389], length 0
19:09:30.012180 IP localhost.amqp > localhost.64135: Flags [P.], seq 590:602, ack 435, win 6372, options [nop,nop,TS val 3025045569 ecr 1983773389], length 12
19:09:30.012195 IP localhost.64135 > localhost.amqp: Flags [.], ack 602, win 6370, options [nop,nop,TS val 1983773389 ecr 3025045569], length 0
19:09:30.012230 IP localhost.64135 > localhost.amqp: Flags [P.], seq 435:457, ack 602, win 6370, options [nop,nop,TS val 1983773389 ecr 3025045569], length 22
19:09:30.012244 IP localhost.amqp > localhost.64135: Flags [.], ack 457, win 6372, options [nop,nop,TS val 3025045569 ecr 1983773389], length 0
19:09:30.012279 IP localhost.amqp > localhost.64135: Flags [P.], seq 602:614, ack 457, win 6372, options [nop,nop,TS val 3025045569 ecr 1983773389], length 12
19:09:30.012295 IP localhost.64135 > localhost.amqp: Flags [.], ack 614, win 6370, options [nop,nop,TS val 1983773389 ecr 3025045569], length 0
19:09:30.012341 IP localhost.64135 > localhost.amqp: Flags [F.], seq 457, ack 614, win 6370, options [nop,nop,TS val 1983773389 ecr 3025045569], length 0
19:09:30.012362 IP localhost.amqp > localhost.64135: Flags [.], ack 458, win 6372, options [nop,nop,TS val 3025045569 ecr 1983773389], length 0
19:09:30.023710 IP localhost.64136 > localhost.amqp: Flags [S], seq 170422768, win 65535, options [mss 16344,nop,wscale 6,nop,nop,TS val 3909848038 ecr 0,sackOK,eol], length 0
19:09:30.023834 IP localhost.amqp > localhost.64136: Flags [S.], seq 4066705377, ack 170422769, win 65535, options [mss 16344,nop,wscale 6,nop,nop,TS val 678295516 ecr 3909848038,sackOK,eol], length 0
19:09:30.023853 IP localhost.64136 > localhost.amqp: Flags [.], ack 1, win 6379, options [nop,nop,TS val 3909848038 ecr 678295516], length 0
19:09:30.023864 IP localhost.amqp > localhost.64136: Flags [.], ack 1, win 6379, options [nop,nop,TS val 678295516 ecr 3909848038], length 0
19:09:30.023878 IP localhost.64136 > localhost.amqp: Flags [P.], seq 1:9, ack 1, win 6379, options [nop,nop,TS val 3909848038 ecr 678295516], length 8
19:09:30.023900 IP localhost.amqp > localhost.64136: Flags [.], ack 9, win 6379, options [nop,nop,TS val 678295516 ecr 3909848038], length 0
19:09:30.023908 IP localhost.amqp > localhost.64136: Flags [P.], seq 1:514, ack 9, win 6379, options [nop,nop,TS val 678295516 ecr 3909848038], length 513
19:09:30.023917 IP localhost.64136 > localhost.amqp: Flags [.], ack 514, win 6371, options [nop,nop,TS val 3909848038 ecr 678295516], length 0
19:09:30.023963 IP localhost.64136 > localhost.amqp: Flags [P.], seq 9:338, ack 514, win 6371, options [nop,nop,TS val 3909848038 ecr 678295516], length 329
19:09:30.023981 IP localhost.amqp > localhost.64136: Flags [.], ack 338, win 6374, options [nop,nop,TS val 678295516 ecr 3909848038], length 0
19:09:30.024004 IP localhost.amqp > localhost.64136: Flags [P.], seq 514:534, ack 338, win 6374, options [nop,nop,TS val 678295516 ecr 3909848038], length 20
19:09:30.024022 IP localhost.64136 > localhost.amqp: Flags [.], ack 534, win 6371, options [nop,nop,TS val 3909848038 ecr 678295516], length 0
19:09:30.024069 IP localhost.64136 > localhost.amqp: Flags [P.], seq 338:358, ack 534, win 6371, options [nop,nop,TS val 3909848038 ecr 678295516], length 20
19:09:30.024072 IP localhost.64136 > localhost.amqp: Flags [P.], seq 358:374, ack 534, win 6371, options [nop,nop,TS val 3909848038 ecr 678295516], length 16
19:09:30.024090 IP localhost.amqp > localhost.64136: Flags [.], ack 358, win 6374, options [nop,nop,TS val 678295516 ecr 3909848038], length 0
19:09:30.024097 IP localhost.amqp > localhost.64136: Flags [.], ack 374, win 6373, options [nop,nop,TS val 678295516 ecr 3909848038], length 0
19:09:30.024113 IP localhost.amqp > localhost.64136: Flags [P.], seq 534:547, ack 374, win 6373, options [nop,nop,TS val 678295516 ecr 3909848038], length 13
19:09:30.024136 IP localhost.64136 > localhost.amqp: Flags [.], ack 547, win 6371, options [nop,nop,TS val 3909848038 ecr 678295516], length 0
19:09:30.024161 IP localhost.64136 > localhost.amqp: Flags [P.], seq 374:387, ack 547, win 6371, options [nop,nop,TS val 3909848038 ecr 678295516], length 13
19:09:30.024179 IP localhost.amqp > localhost.64136: Flags [.], ack 387, win 6373, options [nop,nop,TS val 678295516 ecr 3909848038], length 0
19:09:30.024212 IP localhost.amqp > localhost.64136: Flags [P.], seq 547:563, ack 387, win 6373, options [nop,nop,TS val 678295516 ecr 3909848038], length 16
19:09:30.024230 IP localhost.64136 > localhost.amqp: Flags [.], ack 563, win 6370, options [nop,nop,TS val 3909848038 ecr 678295516], length 0
19:09:30.024264 IP localhost.64136 > localhost.amqp: Flags [P.], seq 387:413, ack 563, win 6370, options [nop,nop,TS val 3909848038 ecr 678295516], length 26
19:09:30.024284 IP localhost.amqp > localhost.64136: Flags [.], ack 413, win 6373, options [nop,nop,TS val 678295516 ecr 3909848038], length 0
19:09:30.024308 IP localhost.amqp > localhost.64136: Flags [P.], seq 563:590, ack 413, win 6373, options [nop,nop,TS val 678295516 ecr 3909848038], length 27
19:09:30.024329 IP localhost.64136 > localhost.amqp: Flags [.], ack 590, win 6370, options [nop,nop,TS val 3909848038 ecr 678295516], length 0
19:09:30.024360 IP localhost.64136 > localhost.amqp: Flags [P.], seq 413:435, ack 590, win 6370, options [nop,nop,TS val 3909848038 ecr 678295516], length 22
19:09:30.024373 IP localhost.amqp > localhost.64136: Flags [.], ack 435, win 6372, options [nop,nop,TS val 678295516 ecr 3909848038], length 0
19:09:30.024395 IP localhost.amqp > localhost.64136: Flags [P.], seq 590:602, ack 435, win 6372, options [nop,nop,TS val 678295516 ecr 3909848038], length 12
19:09:30.024413 IP localhost.64136 > localhost.amqp: Flags [.], ack 602, win 6370, options [nop,nop,TS val 3909848038 ecr 678295516], length 0
19:09:30.024436 IP localhost.64136 > localhost.amqp: Flags [P.], seq 435:457, ack 602, win 6370, options [nop,nop,TS val 3909848038 ecr 678295516], length 22
19:09:30.024454 IP localhost.amqp > localhost.64136: Flags [.], ack 457, win 6372, options [nop,nop,TS val 678295516 ecr 3909848038], length 0
19:09:30.024475 IP localhost.amqp > localhost.64136: Flags [P.], seq 602:614, ack 457, win 6372, options [nop,nop,TS val 678295516 ecr 3909848038], length 12
19:09:30.024493 IP localhost.64136 > localhost.amqp: Flags [.], ack 614, win 6370, options [nop,nop,TS val 3909848038 ecr 678295516], length 0
19:09:30.024518 IP localhost.64136 > localhost.amqp: Flags [F.], seq 457, ack 614, win 6370, options [nop,nop,TS val 3909848038 ecr 678295516], length 0
19:09:30.024537 IP localhost.amqp > localhost.64136: Flags [.], ack 458, win 6372, options [nop,nop,TS val 678295516 ecr 3909848038], length 0
19:09:30.035691 IP localhost.64137 > localhost.amqp: Flags [S], seq 989458542, win 65535, options [mss 16344,nop,wscale 6,nop,nop,TS val 2373726224 ecr 0,sackOK,eol], length 0
19:09:30.035775 IP localhost.amqp > localhost.64137: Flags [S.], seq 3517786082, ack 989458543, win 65535, options [mss 16344,nop,wscale 6,nop,nop,TS val 1000437203 ecr 2373726224,sackOK,eol], length 0
19:09:30.035789 IP localhost.64137 > localhost.amqp: Flags [.], ack 1, win 6379, options [nop,nop,TS val 2373726224 ecr 1000437203], length 0
19:09:30.035797 IP localhost.amqp > localhost.64137: Flags [.], ack 1, win 6379, options [nop,nop,TS val 1000437203 ecr 2373726224], length 0
19:09:30.035823 IP localhost.64137 > localhost.amqp: Flags [P.], seq 1:9, ack 1, win 6379, options [nop,nop,TS val 2373726224 ecr 1000437203], length 8
19:09:30.035849 IP localhost.amqp > localhost.64137: Flags [.], ack 9, win 6379, options [nop,nop,TS val 1000437203 ecr 2373726224], length 0
19:09:30.035857 IP localhost.amqp > localhost.64137: Flags [P.], seq 1:514, ack 9, win 6379, options [nop,nop,TS val 1000437203 ecr 2373726224], length 513
19:09:30.035894 IP localhost.64137 > localhost.amqp: Flags [.], ack 514, win 6371, options [nop,nop,TS val 2373726224 ecr 1000437203], length 0
19:09:30.035950 IP localhost.64137 > localhost.amqp: Flags [P.], seq 9:338, ack 514, win 6371, options [nop,nop,TS val 2373726224 ecr 1000437203], length 329
19:09:30.035964 IP localhost.amqp > localhost.64137: Flags [.], ack 338, win 6374, options [nop,nop,TS val 1000437203 ecr 2373726224], length 0
19:09:30.036002 IP localhost.amqp > localhost.64137: Flags [P.], seq 514:534, ack 338, win 6374, options [nop,nop,TS val 1000437203 ecr 2373726224], length 20
19:09:30.036016 IP localhost.64137 > localhost.amqp: Flags [.], ack 534, win 6371, options [nop,nop,TS val 2373726224 ecr 1000437203], length 0
19:09:30.036063 IP localhost.64137 > localhost.amqp: Flags [P.], seq 338:358, ack 534, win 6371, options [nop,nop,TS val 2373726224 ecr 1000437203], length 20
19:09:30.036066 IP localhost.64137 > localhost.amqp: Flags [P.], seq 358:374, ack 534, win 6371, options [nop,nop,TS val 2373726224 ecr 1000437203], length 16
19:09:30.036079 IP localhost.amqp > localhost.64137: Flags [.], ack 358, win 6374, options [nop,nop,TS val 1000437203 ecr 2373726224], length 0
19:09:30.036084 IP localhost.amqp > localhost.64137: Flags [.], ack 374, win 6373, options [nop,nop,TS val 1000437203 ecr 2373726224], length 0
19:09:30.036119 IP localhost.amqp > localhost.64137: Flags [P.], seq 534:547, ack 374, win 6373, options [nop,nop,TS val 1000437203 ecr 2373726224], length 13
19:09:30.036132 IP localhost.64137 > localhost.amqp: Flags [.], ack 547, win 6371, options [nop,nop,TS val 2373726224 ecr 1000437203], length 0
19:09:30.036170 IP localhost.64137 > localhost.amqp: Flags [P.], seq 374:387, ack 547, win 6371, options [nop,nop,TS val 2373726224 ecr 1000437203], length 13
19:09:30.036186 IP localhost.amqp > localhost.64137: Flags [.], ack 387, win 6373, options [nop,nop,TS val 1000437203 ecr 2373726224], length 0
19:09:30.036219 IP localhost.amqp > localhost.64137: Flags [P.], seq 547:563, ack 387, win 6373, options [nop,nop,TS val 1000437203 ecr 2373726224], length 16
19:09:30.036233 IP localhost.64137 > localhost.amqp: Flags [.], ack 563, win 6370, options [nop,nop,TS val 2373726224 ecr 1000437203], length 0
19:09:30.036278 IP localhost.64137 > localhost.amqp: Flags [P.], seq 387:413, ack 563, win 6370, options [nop,nop,TS val 2373726224 ecr 1000437203], length 26
19:09:30.036293 IP localhost.amqp > localhost.64137: Flags [.], ack 413, win 6373, options [nop,nop,TS val 1000437203 ecr 2373726224], length 0
19:09:30.036328 IP localhost.amqp > localhost.64137: Flags [P.], seq 563:590, ack 413, win 6373, options [nop,nop,TS val 1000437203 ecr 2373726224], length 27
19:09:30.036342 IP localhost.64137 > localhost.amqp: Flags [.], ack 590, win 6370, options [nop,nop,TS val 2373726224 ecr 1000437203], length 0
19:09:30.036384 IP localhost.64137 > localhost.amqp: Flags [P.], seq 413:435, ack 590, win 6370, options [nop,nop,TS val 2373726224 ecr 1000437203], length 22
19:09:30.036398 IP localhost.amqp > localhost.64137: Flags [.], ack 435, win 6372, options [nop,nop,TS val 1000437203 ecr 2373726224], length 0
19:09:30.036434 IP localhost.amqp > localhost.64137: Flags [P.], seq 590:602, ack 435, win 6372, options [nop,nop,TS val 1000437203 ecr 2373726224], length 12
19:09:30.036447 IP localhost.64137 > localhost.amqp: Flags [.], ack 602, win 6370, options [nop,nop,TS val 2373726224 ecr 1000437203], length 0
19:09:30.036484 IP localhost.64137 > localhost.amqp: Flags [P.], seq 435:457, ack 602, win 6370, options [nop,nop,TS val 2373726224 ecr 1000437203], length 22
19:09:30.036497 IP localhost.amqp > localhost.64137: Flags [.], ack 457, win 6372, options [nop,nop,TS val 1000437203 ecr 2373726224], length 0
19:09:30.036533 IP localhost.amqp > localhost.64137: Flags [P.], seq 602:614, ack 457, win 6372, options [nop,nop,TS val 1000437203 ecr 2373726224], length 12
19:09:30.036549 IP localhost.64137 > localhost.amqp: Flags [.], ack 614, win 6370, options [nop,nop,TS val 2373726224 ecr 1000437203], length 0
19:09:30.036597 IP localhost.64137 > localhost.amqp: Flags [F.], seq 457, ack 614, win 6370, options [nop,nop,TS val 2373726224 ecr 1000437203], length 0
19:09:30.036613 IP localhost.amqp > localhost.64137: Flags [.], ack 458, win 6372, options [nop,nop,TS val 1000437203 ecr 2373726224], length 0
19:09:30.047715 IP localhost.64138 > localhost.amqp: Flags [S], seq 2749452506, win 65535, options [mss 16344,nop,wscale 6,nop,nop,TS val 186327649 ecr 0,sackOK,eol], length 0
19:09:30.047800 IP localhost.amqp > localhost.64138: Flags [S.], seq 3803578748, ack 2749452507, win 65535, options [mss 16344,nop,wscale 6,nop,nop,TS val 3343858782 ecr 186327649,sackOK,eol], length 0
19:09:30.047814 IP localhost.64138 > localhost.amqp: Flags [.], ack 1, win 6379, options [nop,nop,TS val 186327649 ecr 3343858782], length 0
19:09:30.047821 IP localhost.amqp > localhost.64138: Flags [.], ack 1, win 6379, options [nop,nop,TS val 3343858782 ecr 186327649], length 0
19:09:30.047848 IP localhost.64138 > localhost.amqp: Flags [P.], seq 1:9, ack 1, win 6379, options [nop,nop,TS val 186327649 ecr 3343858782], length 8
19:09:30.047863 IP localhost.amqp > localhost.64138: Flags [.], ack 9, win 6379, options [nop,nop,TS val 3343858782 ecr 186327649], length 0
19:09:30.047873 IP localhost.amqp > localhost.64138: Flags [P.], seq 1:514, ack 9, win 6379, options [nop,nop,TS val 3343858782 ecr 186327649], length 513
19:09:30.047886 IP localhost.64138 > localhost.amqp: Flags [.], ack 514, win 6371, options [nop,nop,TS val 186327649 ecr 3343858782], length 0
19:09:30.047925 IP localhost.64138 > localhost.amqp: Flags [P.], seq 9:338, ack 514, win 6371, options [nop,nop,TS val 186327649 ecr 3343858782], length 329
19:09:30.047938 IP localhost.amqp > localhost.64138: Flags [.], ack 338, win 6374, options [nop,nop,TS val 3343858782 ecr 186327649], length 0
